ID,company,contact,country,deadline,description,employmentType,industry,jobTitle,jobType,positionLevel,positions,qualification,readvertised,requirements,responsibilities,salary,skills,technology,town,uploadDate,url,website,year
1,RefuSHE,N/A,Kenya,N/A,,,"NGO, NPO & Charity",Computer Science Teacher & Digital Learning Specialist,, Mid level ,1,: Bachelor ,N/A," for safety and security and their longer-term needs of healthcare, education, empowerment, and income generation. Founded in 2008, RefuSHE Inc is a U.S. nonprofit, headquartered in the U.S. and operating in Nairobi, Kenya. Our mission is to protect, educate, and empower orphaned, unaccompanied, or separated refugee girls and young women and to help them build healthier and more resilient futures for themselves and their children.  OPPORTUNITY RefuSHE is looking for a computer/IT trainer and digital learning specialist to join its education team in Nairobi, Kenya. RefuSHE is in the process of building an IT lab and rolling out a Technology Training curriculum as a second vocational track. RefuSHE is looking for a skilled computer science teacher who is familiar with CISCO and Microsoft systems and curriculum. They should have experience training adolescents with an ideal background of trauma-informed teaching or working with refugees. They will also play a key role in a new flagship program being launched by RefuSHE in partnership with the Mastercard Foundation and Kytabu. The program aims to develop an E-Learning and Wellness Platform for urban refugees, with a specific emphasis on girls and women. The candidate will serve as REfuSHE’s technology lead to ensure staff and students can use the platform intentionally and effectively. They should have experience in digital curriculum design, technology integration, and developing IT/ Computer Science/STEM curriculum for primary and secondary schools as well as adult learnings. The candidate will work alongside the program team to digitize RefuSHE’s curriculum and trauma-informed approach and will need to have a strong understanding of how to translate pedagogy and methodologies to digital resources. Ideal candidate has a strong educational background, demonstrated technical acumen, advanced teaching skills, and a passion for working with young people. They should be proactive and self-motivated to advance the use of technology for education. E-LEARNING & WELLNESS PLATFORM DESIGN, DEVELOPMENT, AND LAUNCH • Effectively coach, engage, and motivate team members who are responsible for the production, implementation, management, and evaluation of the curriculum on the E-Platform. • Serve as the main liaison between RefuSHE’s team and Kytabu’s team (Partner Ed-Tech Firm) • Work with RefuSHE’s teachers, case managers, and counsellors to digitize REfuSHE’s curriculum, approach, and methodology • Work with senior leadership to drive utilization of student-centered digital curriculum • Work with RefuSHE’s technology partner Kytabu to identify best practices for digitizing the ideal “learning journey” for urban refugees • Train RefuSHE staff and students on how to effectively use the platform • Train community members on platform use during beta-testing and official launch IT LAB & VOCATIONAL TRAINING CURRICULUM DESIGN • Responsible for launching and managing RefuSHE’s IT Teaching Lab • Will be trained in CISCO systems and training materials • Design effective and appropriate training curriculum using CISCO’s modules as well as creating additional modules • Responsible for creating a robust vocational track to support refugee girls and young women to gain expertise in computer science and digital media to support their ability to gain income generating opportunities • Serve as RefuSHE’s main technology/computer science teacher and recruit part-time and full-time trainers as the vocation track is built and grown • Suggest solutions for increasing access to STEM education for refugee girls and women. • Oversee program implementation and design to deepen RefuSHE’s impact in the field of refugee IT, digital media, and computer science education • Lead the program team to develop creative and outcome driven program activities and interventions • Ensure that all programs are developed and implemented with a trauma-informed lens • Strengthen program design to elevate RefuSHE as a strong and desirable contender for funding, partnerships, and recognition for excellent service and outcomes • Ensure program quality through rigorous assessment, design, development, comprehensive data collection and tracking • Maintain official records and documents and ensure compliance with international, federal, state, and local regulations • Work with Education Officer and Associate Director of GEP to strengthen and build RefuSHE’s academic offerings CANDIDATE PROFILE This position is responsible for educational technologies and multimedia training as well as supporting the design, development, and launch of RefuSHE’s new Learning Management System (E-Learning Platform). They must have strong interpersonal skills and technical knowledge as well as experience in distance education methodologies and instructional design processes. Understanding and experience in online and videoconference instructional course design. The ideal candidate should be a highly effective, organized, and flexible leader and digital innovator. S/he will have the following professional and personal qualities, skills and characteristics: • A Bachelor’s degree in a related field such as education, education technology, Information Technology, Computer Science or related field of study is required • Master’s degree or equivalent in Education Technology preferred • 5-10 years of teaching and training experience • Experience teaching adolescent girls and young women with high vulnerabilities preferred • Demonstrated experience in areas of digital curriculum design, technology integration, and computer science and digital media instruction and training a plus • Demonstrated experience working in the Ed-Tech space including designing digital literacy curriculum, working on education technology platforms, training schools, students, or teachers in digital tools preferred. • Proficiency in Word, Excel, and PowerPoint. • The ability to work and live in Kenya; fluency in English and Kiswahili • Language skills in French or local dialects spoken in Somalia, Congo, and South Sudan a plus SALARY & BENEFITS Salary is competitive and based on the candidate’s experience and qualifications. The benefits package includes medical healthcare coverage and pension. How to apply To express your interest in this role, please submit your resume and cover letter to hr2019@refuSHE.org indicating the position title in the email subject. Please note applications without a thoughtful cover letter will be considered incomplete. Human Resources & Administration Manager RefuSHE P.O. Box 63192-00619, Nairobi Closing date for applications is July 31, 2020 . Applications will be reviewed on a rolling basis. Please note that only shortlisted candidates will be contacted Share Job Post",,Confidential," for safety and security and their longer-term needs of healthcare, education, empowerment, and income generation. Founded in 2008, RefuSHE Inc is a U.S. nonprofit, headquartered in the U.S. and operating in Nairobi, Kenya. Our mission is to protect, educate, and empower orphaned, unaccompanied, or separated refugee girls and young women and to help them build healthier and more resilient futures for themselves and their children.  OPPORTUNITY RefuSHE is looking for a computer/IT trainer and digital learning specialist to join its education team in Nairobi, Kenya. RefuSHE is in the process of building an IT lab and rolling out a Technology Training curriculum as a second vocational track. RefuSHE is looking for a skilled computer science teacher who is familiar with CISCO and Microsoft systems and curriculum. They should have experience training adolescents with an ideal background of trauma-informed teaching or working with refugees. They will also play a key role in a new flagship program being launched by RefuSHE in partnership with the Mastercard Foundation and Kytabu. The program aims to develop an E-Learning and Wellness Platform for urban refugees, with a specific emphasis on girls and women. The candidate will serve as REfuSHE’s technology lead to ensure staff and students can use the platform intentionally and effectively. They should have experience in digital curriculum design, technology integration, and developing IT/ Computer Science/STEM curriculum for primary and secondary schools as well as adult learnings. The candidate will work alongside the program team to digitize RefuSHE’s curriculum and trauma-informed approach and will need to have a strong understanding of how to translate pedagogy and methodologies to digital resources. Ideal candidate has a strong educational background, demonstrated technical acumen, advanced teaching skills, and a passion for working with young people. They should be proactive and self-motivated to advance the use of technology for education. E-LEARNING & WELLNESS PLATFORM DESIGN, DEVELOPMENT, AND LAUNCH • Effectively coach, engage, and motivate team members who are responsible for the production, implementation, management, and evaluation of the curriculum on the E-Platform. • Serve as the main liaison between RefuSHE’s team and Kytabu’s team (Partner Ed-Tech Firm) • Work with RefuSHE’s teachers, case managers, and counsellors to digitize REfuSHE’s curriculum, approach, and methodology • Work with senior leadership to drive utilization of student-centered digital curriculum • Work with RefuSHE’s technology partner Kytabu to identify best practices for digitizing the ideal “learning journey” for urban refugees • Train RefuSHE staff and students on how to effectively use the platform • Train community members on platform use during beta-testing and official launch IT LAB & VOCATIONAL TRAINING CURRICULUM DESIGN • Responsible for launching and managing RefuSHE’s IT Teaching Lab • Will be trained in CISCO systems and training materials • Design effective and appropriate training curriculum using CISCO’s modules as well as creating additional modules • Responsible for creating a robust vocational track to support refugee girls and young women to gain expertise in computer science and digital media to support their ability to gain income generating opportunities • Serve as RefuSHE’s main technology/computer science teacher and recruit part-time and full-time trainers as the vocation track is built and grown • Suggest solutions for increasing access to STEM education for refugee girls and women. • Oversee program implementation and design to deepen RefuSHE’s impact in the field of refugee IT, digital media, and computer science education • Lead the program team to develop creative and outcome driven program activities and interventions • Ensure that all programs are developed and implemented with a trauma-informed lens • Strengthen program design to elevate RefuSHE as a strong and desirable contender for funding, partnerships, and recognition for excellent service and outcomes • Ensure program quality through rigorous assessment, design, development, comprehensive data collection and tracking • Maintain official records and documents and ensure compliance with international, federal, state, and local regulations • Work with Education Officer and Associate Director of GEP to strengthen and build RefuSHE’s academic offerings CANDIDATE PROFILE This position is responsible for educational technologies and multimedia training as well as supporting the design, development, and launch of RefuSHE’s new Learning Management System (E-Learning Platform). They must have strong interpersonal skills and technical knowledge as well as experience in distance education methodologies and instructional design processes. Understanding and experience in online and videoconference instructional course design. The ideal candidate should be a highly effective, organized, and flexible leader and digital innovator. S/he will have the following professional and personal qualities, skills and characteristics: • A Bachelor’s degree in a related field such as education, education technology, Information Technology, Computer Science or related field of study is required • Master’s degree or equivalent in Education Technology preferred • 5-10 years of teaching and training experience • Experience teaching adolescent girls and young women with high vulnerabilities preferred • Demonstrated experience in areas of digital curriculum design, technology integration, and computer science and digital media instruction and training a plus • Demonstrated experience working in the Ed-Tech space including designing digital literacy curriculum, working on education technology platforms, training schools, students, or teachers in digital tools preferred. • Proficiency in Word, Excel, and PowerPoint. • The ability to work and live in Kenya; fluency in English and Kiswahili • Language skills in French or local dialects spoken in Somalia, Congo, and South Sudan a plus SALARY & BENEFITS Salary is competitive and based on the candidate’s experience and qualifications. The benefits package includes medical healthcare coverage and pension. How to apply To express your interest in this role, please submit your resume and cover letter to hr2019@refuSHE.org indicating the position title in the email subject. Please note applications without a thoughtful cover letter will be considered incomplete. Human Resources & Administration Manager RefuSHE P.O. Box 63192-00619, Nairobi Closing date for applications is July 31, 2020 . Applications will be reviewed on a rolling basis. Please note that only shortlisted candidates will be contacted Share Job Post","Research, Teaching & Training",Nairobi,N/A,https://www.brightermonday.co.ke/listings/computer-science-teacher-digital-learning-specialist-mpj4ng,https://www.brightermonday.co.ke,N/A
1,Borderless Tracking Ltd,N/A,Kenya,N/A, Reports to Human Resource & Administration Manager. Should have worked in Office Administration in the Mid level or senior level management. Minimum Qualification: Diploma Experience Level: Mid level Experience Length: 5 years Job Description ,,Enforcement & Security,Office Administrator - Mombasa,,,1,s Leadership Skills Human Skills Conceptual Skills Education:- Business Administration Higher diploma Degree and HR ,N/A,,,Confidential,,Admin & Office,Mombasa,N/A,https://www.brightermonday.co.ke/listings/office-administrator-mombasa-dk2nw4,https://www.brightermonday.co.ke,N/A
1,Summit Recruitment & Search,N/A,Kenya,N/A," Our client, a Global Security Company is looking to recruit a Digital Marketing Manager to support the East Africa market. The successful candidate MUST have a minimum of 5 years of management experience working in digital marketing including SEM, SEO and Social Media. Candidates with International experience will have a distinct advantage. Minimum Qualification: Bachelor Experience Level: Senior level Experience Length: 7 years Job Description Key ",,Enforcement & Security,East Africa Digital Marketing Manager,," Bachelor's Degree. Position level: Lower Mid Level. Location: Nairobi, Kenya. Deadline: 27th July 2020. We endeavour to contact all our applicants, but unfortunately, high volumes of applications make this unrealistic. If you do not hear from us within two weeks, your application has not been successful on this occasion. This does not mean you will not be considered for future roles, so please keep an eye on our job board and apply for positions that match your skills and ",1,: • Must have a relevant university degree in communication or Marketing. • Must have a minimum of 7 years of ,N/A,," • Work with senior managers to develop a comprehensive cross-channel online marketing strategy. • Identify, analyze, evaluate and execute strategic digital media partnerships. • Perform research, deal sourcing, origination and negotiation of digital partnership & SLA. • Collaborate on the corporate communication calendar and overall marketing plan. • Responsible for SEM, SEO audit and suggest areas of improvement. • Suggest and manage improvements in landing pages and other conversion optimization tools. • Collaborate and contribute to the Company’s content strategy and editorial planning. • Work in collaboration with the Global team and partner agency for projects about defined strategy, digital campaigns and business needs. • Generate an ROI dashboard for marketing activities for sales and leadership teams. • Ensure quality control for all brand/marketing related projects. • Perform strategy and competitive monitoring. Qualificationexperience in Digital Marketing. • Must have a minimum of 5 years managing a Digital Marketing Department. • International work experience would be an added advantage. • Experience working with and knowledge of Photoshop or Illustrator. • Strong oral and written communication skills. • Proven ability to establish superior relationships. Monthly gross salary: Ksh. 350,000 – 400,000 /= (Approx. 3,500 – 4,000 USD) plus benefits depending on individual skills & experience. Education Level:experience.  Summit Recruitment & Search, as a policy, does not charge any fee as a pre-employment or post-employment ",Confidential,,Marketing & Communications,Nairobi,N/A,https://www.brightermonday.co.ke/listings/east-africa-digital-marketing-manager-p6jj24,https://www.brightermonday.co.ke,N/A
1,J.Touch Limited,N/A,Kenya,N/A,,,Enforcement & Security,Sales Person,, Mid level ,1,: Diploma ,N/A,,,Confidential,,Sales,Nairobi,N/A,https://www.brightermonday.co.ke/listings/sales-person-jrxx2g,https://www.brightermonday.co.ke,N/A
1,Kibabii University,N/A,Kenya,N/A,,,Education,Tutorial Fellow (Computer Education),, Mid level ,1,: Bachelor ,N/A,,,Confidential,,"Research, Teaching & Training",Rest of Kenya,N/A,https://www.brightermonday.co.ke/listings/tutorial-fellow-computer-education-2qww7k,https://www.brightermonday.co.ke,N/A
1,Affordable Computer Services (K) Limited,N/A,Kenya,N/A," IT Engineer will manage organizations’ computer systems, including software, hardware and networks. Must be competent and will report to IT Manager. Minimum Qualification: Diploma Experience Level: Mid level Experience Length: 4 years Job Description IT Engineer Duties and ",,IT & Telecoms,IT Engineer,,,1,,N/A,,,Confidential,,Engineering & Technology,Nairobi,N/A,https://www.brightermonday.co.ke/listings/it-engineer-kgxxn8,https://www.brightermonday.co.ke,N/A
1,Afrinet Telecom Limited,N/A,Kenya,N/A," Develop and implement new software programs by fully understanding of JAVA, JavaScript, .PHP,, ANDROID,and their environments. Minimum Qualification: Bachelor Experience Level: Mid level Experience Length: 3 years Job Description Location: Spur Mall Thika Road Requirements The following are the requirements for this role; • A University degree from an institution a relevant field in Information Technology/ Computer Science/Software Development/Computer Engineering or equivalent diploma qualifications. • Proficiency with fundamental front end languages such as HTML, CSS and JavaScript. • Familiarity with JavaScript frameworks such as Node, React and Vue. • Demonstrable proficiency in any of the following Programming Languages: PHP, Java or Python. • Knowledge of frameworks such as Laravel, Java Spring, Django etc. is an added advantage. • Proficiency in web development: HTML, JavaScript, and CSS. Proficiency with web development tools and libraries such as Bootstrap, JQuery and AngularJS etc. is an added advantage. • Knowledgeable of the many tools in machine learning, artificial intelligence, and data mining. • Strong data structures and algorithm design skills • Ability to use logic and reason to identify the strengths and weaknesses of alternative solutions. • Familiarity with database technology such as MySQL, Oracle and MongoDB. • Must Demonstrable proficiency in android development using java or kotlin • Desirable: Linux administration; Knowledge of version control software (SVN, GIT). • Familiarity with design. Adobe XD, Photoshop, Illustrator. • Excellent verbal communication skills. • Good problem-solving skills ",,IT & Telecoms,Mobile & Web Software Developer,,,1,,N/A, for new systems or new functionality • Develop and maintain design documents for respective systems and interfaces. • To carry out systems development as per laid out requirements. • To develop interfaces between systems as the need arises. • To provide user support for respective systems. • To ensure that proper technical and user documentation is maintained for all systems. • To provide analytical information/reports from systems as required. • Recommend improvements to existing software programs as necessary. Share Job Post,,Confidential, for new systems or new functionality • Develop and maintain design documents for respective systems and interfaces. • To carry out systems development as per laid out requirements. • To develop interfaces between systems as the need arises. • To provide user support for respective systems. • To ensure that proper technical and user documentation is maintained for all systems. • To provide analytical information/reports from systems as required. • Recommend improvements to existing software programs as necessary. Share Job Post,Software & Data,Nairobi,N/A,https://www.brightermonday.co.ke/listings/mobile-web-software-developer-nxjzx0,https://www.brightermonday.co.ke,N/A
1,Anonymous Employer,N/A,Kenya,N/A,,,IT & Telecoms,Web & Mobile App Developer,, Mid level ,1,: Diploma ,N/A,,,Confidential,,Software & Data,Nairobi,N/A,https://www.brightermonday.co.ke/listings/web-mobile-app-developer-w2k2r0,https://www.brightermonday.co.ke,N/A
1,Potential Staffing Limited,N/A,Kenya,N/A, We are looking for a Program Administrator to coordinate operations and people for various programs in our organization.Program Administrator ,,Recruitment,Program Administrator,, Mid level ,1,: Bachelor ,N/A, • Proven experience as a program coordinator or similar role • Experience in budgeting and fundraising • Familiarity with industry-related laws and regulations • Knowledge of recruiting processes • Tech-savvy with working knowledge of time and project management software • Strong organizational and leadership skills • Exceptional communication skills • Analytical thinking • Problem-solving aptitude • BSc/BA in Business or relevant field Qualified Candidates are Encouraged to Apply Share Job Post,,Confidential, • Proven experience as a program coordinator or similar role • Experience in budgeting and fundraising • Familiarity with industry-related laws and regulations • Knowledge of recruiting processes • Tech-savvy with working knowledge of time and project management software • Strong organizational and leadership skills • Exceptional communication skills • Analytical thinking • Problem-solving aptitude • BSc/BA in Business or relevant field Qualified Candidates are Encouraged to Apply Share Job Post,Product & Project Management,Nairobi,N/A,https://www.brightermonday.co.ke/listings/program-administrator-jrxx4d,https://www.brightermonday.co.ke,N/A
1,Grow Mobile Technology,N/A,Kenya,N/A," As a Software Team Lead, you will be at the forefront of our system design, implementation and delivery of our projects. You will guide both the organ Minimum Qualification: Bachelor Experience Level: Senior level Experience Length: 5 years Job Description Key ",,IT & Telecoms,Software Team Lead,,,1,"s and Characteristics: You’re a good fit for this role if you meet the specifications below: Strong software development background, at least 5 years ",N/A,,,Confidential,,Software & Data,Nairobi,N/A,https://www.brightermonday.co.ke/listings/software-team-lead-g9ddk9,https://www.brightermonday.co.ke,N/A
