ID,company,contact,country,deadline,description,employmentType,industry,jobTitle,jobType,positionLevel,positions,qualification,readvertised,requirements,responsibilities,salary,skills,technology,town,uploadDate,url,website,year
1,Pharo Ventures Kenya Limited,N/A,Kenya,N/A," Providing investment analysis, business development and reporting support to enterprises across Eastern Africa. Minimum Qualification: Bachelor Experience Level: Mid level Experience Length: 4 years Job Description COMPANY OVERVIEW: Pharo Ventures is the commercial, for-profit arm of The Pharo Foundation and has been set up to harness the power of a vibrant private sector by investing in enterprises across a variety of sectors within the East Africa region. The objective is to build and grow, commercially and environmentally sustainable businesses, with a focus on maximising creation of economic value and jobs, for the local communities. We have a vision of an economically vibrant and inclusive Africa. Matching that vision is our ambition to create a portfolio of sustainable business ventures that by the end of 2025, will deliver more than five thousand direct jobs across the region. We believe we can achieve our vision and ambitions by investing in the human and physical capital of Africa. For each target country in the region, Pharo Ventures will innovatively build a portfolio of businesses that will be financially sustainable, create value for the local communities and environmentally responsible. Headquartered in London, the organization has an operational HQ in Nairobi and offices in Ethiopia (Addis Ababa and Assosa) and Somaliland (Hargeisa). POSITION SUMMARY: The Investment Analyst is a critical role based in Nairobi but providing investment analysis, business development and reporting support to enterprises across Eastern Africa. The role reports to the CEO of Social Enterprises based in Nairobi. This role will provide support to the CEO of Social Enterprises and the overall social enterprise team, in the identification, financial modelling and analysis, impact analysis, due diligence and execution of social enterprises. The candidate will need to be socially driven. He / She will understand the ethos of social investing and be effective in integrating impact analysis in the business environment. We are looking for a candidate who has extremely strong research and financial analysis skills. This includes a solid understanding of accounting and financial analysis, the ability to work effectively as part of a small team, and an interest in the aims of social enterprise. The incumbent will be comfortable with the financial, commercial, operational and strategic aspects of social investments. In addition, the incumbent will be a strong collaborator both internally and externally with various stakeholders. DIRECT REPORTS: • None FUNCTIONAL RELATIONSHIPS: • Investment Managers in the target countries. • Leaders of the Social Enterprises. EXTERNAL RELATIONSHIPS: • External stakeholders and data providers. Research collaborators. • Investment agencies in country. Government and regulatory authorities. • Local communities. KEY DUTIES AND ",,"NGO, NPO & Charity",Investment Analyst,,,1, will be a significant advantage. • At least 4 years’ ,N/A," and investments returns from new business proposals under consideration. • Support the financial analysis and forecasting of growth projections for existing enterprises. • Through quantitative and qualitative impact data and financial analysis, identify the strengths and opportunities to improve overall performance of the companies. • Perform extensive analytics on historical performance, and develop forecasts on the short and long-term performance of the portfolio companies. • Provide analytical data and input in the development of country investment strategies. Due diligence support and input into enterprise business plans. • Contribute to the drafting of business plans, investment analysis documents and other material for review. • Support the development of enterprise specific business plans prior to launch of the company operations and as required for company growth and expansion. • Assist in the management of data, trends, insights and metrics for the business portfolio across the region. • Carry out site visits to potential and existing business. • Maintain a rolling database of potential business ventures for screening and analysis. Financial and impact forecasting and reporting. • Support all aspects of investment portfolio management, monitoring the social and financial performance of existing investments, reviewing management information and compliance with organization policy. • Undertake social performance assessments of existing and prospective enterprises in the portfolio. • Support the financial and social impact metrics reporting, for the portfolio. Research. • Support in-depth and extensive market research and analysis for target countries and sectors of interest to Pharo Ventures. • As needed, provide market research and analysis for existing businesses as they roll out growth strategies. • Undertake targeted research and marketing efforts in order to support the development of a pipeline of new social investment business opportunities. KNOWLEDGE AND EXPERIENCE REQUIREMENTS: • Bachelor’s degree in Finance, Economics, Engineering, Law, Business Management or related fields is mandatory. • Relevant post-graduate Master's Degree (preferably in Finance or Investment Analysis) or an MBA is strongly preferred. • CPA or CFA qualificationexperience in the private sector, working in investment analysis, accounting, corporate finance or project finance, with exposure to multiple sectors and countries in the larger east Africa region. • Excellent MS Excel and financial modelling skills are required and advanced use of the Microsoft Office suite. • Experience supporting the development and roll out of business plans is preferred. • Solid ability and experience to conduct research and due diligence is required. • Extensive experience with budget development, financial forecasting and analysis of impact metrics is required. • Preferred candidate will be highly analytical, organised and a pragmatic professional who pays attention to details. • Enthusiasm and commitment to working in a fast-paced, entrepreneurial environment. • Willingness to travel and visit business sites across the region. BEHAVIOURAL COMPETENCIES: • Ability to combine analytical thinking and the capacity to operationalise plans. • Structured, process oriented and a logical thinker. • Excellent time-manager who can balance multiple priorities. • Motivated to learn and perform and not afraid to ask questions. • Willing to challenge status quo and add value by introducing positive change. • Good communicator and comfortable to work in a team environment. • High professional and ethical standards. APPLICATION PROCEDURE Review of applications will be on a rolling basis. In the event that we identify an outstanding applicant early in the search process, we reserve the right to appoint before the deadline. For this reason, we encourage interested candidates to apply at the earliest possible time. Due to the high volume of applications expected, we regret that we will only be able to contact short-listed candidates. To apply, please send a detailed cover letter and CV (preferably as a single PDF file) Kindly note that if shortlisted for interview, you will be required to provide samples of financial models you have developed in the past. We shall also request for a list of five referees from all those shortlisted. Share Job Post"," Investment analysis and financial modelling. • With guidance from supervisor, build financial and project models to analyse investment ",Confidential," and investments returns from new business proposals under consideration. • Support the financial analysis and forecasting of growth projections for existing enterprises. • Through quantitative and qualitative impact data and financial analysis, identify the strengths and opportunities to improve overall performance of the companies. • Perform extensive analytics on historical performance, and develop forecasts on the short and long-term performance of the portfolio companies. • Provide analytical data and input in the development of country investment strategies. Due diligence support and input into enterprise business plans. • Contribute to the drafting of business plans, investment analysis documents and other material for review. • Support the development of enterprise specific business plans prior to launch of the company operations and as required for company growth and expansion. • Assist in the management of data, trends, insights and metrics for the business portfolio across the region. • Carry out site visits to potential and existing business. • Maintain a rolling database of potential business ventures for screening and analysis. Financial and impact forecasting and reporting. • Support all aspects of investment portfolio management, monitoring the social and financial performance of existing investments, reviewing management information and compliance with organization policy. • Undertake social performance assessments of existing and prospective enterprises in the portfolio. • Support the financial and social impact metrics reporting, for the portfolio. Research. • Support in-depth and extensive market research and analysis for target countries and sectors of interest to Pharo Ventures. • As needed, provide market research and analysis for existing businesses as they roll out growth strategies. • Undertake targeted research and marketing efforts in order to support the development of a pipeline of new social investment business opportunities. KNOWLEDGE AND EXPERIENCE REQUIREMENTS: • Bachelor’s degree in Finance, Economics, Engineering, Law, Business Management or related fields is mandatory. • Relevant post-graduate Master's Degree (preferably in Finance or Investment Analysis) or an MBA is strongly preferred. • CPA or CFA qualificationexperience in the private sector, working in investment analysis, accounting, corporate finance or project finance, with exposure to multiple sectors and countries in the larger east Africa region. • Excellent MS Excel and financial modelling skills are required and advanced use of the Microsoft Office suite. • Experience supporting the development and roll out of business plans is preferred. • Solid ability and experience to conduct research and due diligence is required. • Extensive experience with budget development, financial forecasting and analysis of impact metrics is required. • Preferred candidate will be highly analytical, organised and a pragmatic professional who pays attention to details. • Enthusiasm and commitment to working in a fast-paced, entrepreneurial environment. • Willingness to travel and visit business sites across the region. BEHAVIOURAL COMPETENCIES: • Ability to combine analytical thinking and the capacity to operationalise plans. • Structured, process oriented and a logical thinker. • Excellent time-manager who can balance multiple priorities. • Motivated to learn and perform and not afraid to ask questions. • Willing to challenge status quo and add value by introducing positive change. • Good communicator and comfortable to work in a team environment. • High professional and ethical standards. APPLICATION PROCEDURE Review of applications will be on a rolling basis. In the event that we identify an outstanding applicant early in the search process, we reserve the right to appoint before the deadline. For this reason, we encourage interested candidates to apply at the earliest possible time. Due to the high volume of applications expected, we regret that we will only be able to contact short-listed candidates. To apply, please send a detailed cover letter and CV (preferably as a single PDF file) Kindly note that if shortlisted for interview, you will be required to provide samples of financial models you have developed in the past. We shall also request for a list of five referees from all those shortlisted. Share Job Post","Accounting, Auditing & Finance",Nairobi,N/A,https://www.brightermonday.co.ke/listings/investment-analyst-5xzd97,https://www.brightermonday.co.ke,N/A
1,Altima Africa Ltd,N/A,Kenya,N/A,,,Recruitment,HR Analyst,, Mid level ,1,: Bachelor ,N/A," University Degree in Business or a related field; Post Graduate Diploma in Human Resource Management or equivalent certification-a must; 2 years’ work experience specifically within Talent Acquisition; Project management skills & proficient in MS Word, Excel and PowerPoint- a must; Organisational savvy, excellent attention to detail with sound judgement Quick learner. Thinks on their feet. Personable team player with a positive & creative attitude. Research, Analysis, and Report writing capabilities. Initiative & proactive with the ability to prioritize, multi task and deliver on multiple projects within tight deadlines. HOW TO APPLY If you are qualified and up to the challenge, please apply online. Only shortlisted candidates will be contacted. Share Job Post",,Confidential," University Degree in Business or a related field; Post Graduate Diploma in Human Resource Management or equivalent certification-a must; 2 years’ work experience specifically within Talent Acquisition; Project management skills & proficient in MS Word, Excel and PowerPoint- a must; Organisational savvy, excellent attention to detail with sound judgement Quick learner. Thinks on their feet. Personable team player with a positive & creative attitude. Research, Analysis, and Report writing capabilities. Initiative & proactive with the ability to prioritize, multi task and deliver on multiple projects within tight deadlines. HOW TO APPLY If you are qualified and up to the challenge, please apply online. Only shortlisted candidates will be contacted. Share Job Post",Human Resources,Nairobi,N/A,https://www.brightermonday.co.ke/listings/hr-analyst-nxjw9w,https://www.brightermonday.co.ke,N/A
1,Potential Staffing Limited,N/A,Kenya,N/A," We are looking for a passionate certified Data Analyst. The successful candidate will turn data into information, information into insight and insight into business decisions. Minimum Qualification: Bachelor Experience Level: Mid level Experience Length: 3 years Job Description Data Analyst Job Duties Data analyst ",,Recruitment,Data Analyst,,,1,,N/A,", activities and design. Data analysts will develop analysis and reporting capabilities. They will also monitor performance and quality control plans to identify improvements. Responsibilities • Interpret data, analyze results using statistical techniques and provide ongoing reports • Develop and implement databases, data collection systems, data analytics and other strategies that optimize statistical efficiency and quality • Acquire data from primary or secondary data sources and maintain databases/data systems • Identify, analyze, and interpret trends or patterns in complex data sets • Filter and “clean” data by reviewing computer reports, printouts, and performance indicators to locate and correct code problems • Work with management to prioritize business and information needs • Locate and define new process improvement opportunities Requirements • Proven working experience as a Data Analyst or Business Data Analyst • Technical expertise regarding data models, database design development, data mining and segmentation techniques • Strong knowledge of and experience with reporting packages (Business Objects etc.), databases (SQL etc.), programming (XML, JavaScript, or ETL frameworks) • Knowledge of statistics and experience using statistical packages for analyzing datasets (Excel, SPSS, SAS etc.) • Strong analytical skills with the ability to collect, organize, analyze, and disseminate significant amounts of information with attention to detail and accuracy • Adept at queries, report writing and presenting findings • BS in Mathematics, Economics, Computer Science, Information Management or Statistics Qualified Candidates are required to apply. Share Job Post",,Confidential,", activities and design. Data analysts will develop analysis and reporting capabilities. They will also monitor performance and quality control plans to identify improvements. Responsibilities • Interpret data, analyze results using statistical techniques and provide ongoing reports • Develop and implement databases, data collection systems, data analytics and other strategies that optimize statistical efficiency and quality • Acquire data from primary or secondary data sources and maintain databases/data systems • Identify, analyze, and interpret trends or patterns in complex data sets • Filter and “clean” data by reviewing computer reports, printouts, and performance indicators to locate and correct code problems • Work with management to prioritize business and information needs • Locate and define new process improvement opportunities Requirements • Proven working experience as a Data Analyst or Business Data Analyst • Technical expertise regarding data models, database design development, data mining and segmentation techniques • Strong knowledge of and experience with reporting packages (Business Objects etc.), databases (SQL etc.), programming (XML, JavaScript, or ETL frameworks) • Knowledge of statistics and experience using statistical packages for analyzing datasets (Excel, SPSS, SAS etc.) • Strong analytical skills with the ability to collect, organize, analyze, and disseminate significant amounts of information with attention to detail and accuracy • Adept at queries, report writing and presenting findings • BS in Mathematics, Economics, Computer Science, Information Management or Statistics Qualified Candidates are required to apply. Share Job Post",Software & Data,Nairobi,N/A,https://www.brightermonday.co.ke/listings/data-analyst-99nwk8,https://www.brightermonday.co.ke,N/A
1,Potential Staffing Limited,N/A,Kenya,N/A," We are hiring for a dynamic individual who will have a key position in our client Strategy and Data team. The Business Intelligence (BI) Analyst will use strong internal data resources to uncover and share insights and inform business decisions throughout the company.The Analyst combines technical skills, creativity, and business acumen to improve our understanding of the company, produce operational improvements, and increase transparency and accountability.Analytic findings and recommendations are communicated clearly and concisely to the business, with follow-on support to ensure the proper measurement and evaluation. Minimum Qualification: Bachelor Experience Level: Mid level Experience Length: 2 years Job Description ",,Recruitment,Business Intelligent Analyst,,,1,,N/A," on key analytic / reporting needs from key business stakeholders •Query data from various internal and external databases using database languages (e.g., SQL, U-SQL) •Clean, interpret, and analyze data using statistical techniques •Build models, analysis, and transformations on internal data using Excel, SQL and R •Test and QA code to ensure high-quality analysis •Design user-friendly, clear, and impactful presentations of analytic findings •Improve and streamline technical and business processes •Train stakeholders throughout the business to improve data fluency •Work together with the business to ensure we are enabling data-driven decision making on the most important business questions EXPERIENCE AND SKILLS •2+ years’ experience working in technical data analytics, with excellent skills in SQL and preferred skills in advanced analytical, statistical, and / or programming skills, including R, Python, DAX, Excel, and data visualization tools (e.g. PowerBI, Tableau) •Career passion and if possible, education background preferred in Statistics, Mathematics, Computer Science, Economics or related field •Strong preference for candidates based in or with strong experience working in the markets or similar markets •Preference for candidates who have worked directly delivering data driven insights and analysis from Artificial Intelligence and Machine learning data science models •Excellent communication skills and ability to work and equal ability to influence executives across cross-functions and geographies •Experience and a high capacity in managing multiple problems and assignments at the same time and delivering high quality outputs •In-depth knowledge of business effectiveness tools COMPENSATION : Competitive package covering a monthly salary, performance bonus and medical benefits reflective of the candidate’s experience and skills. Women, minorities and people with disabilities are strongly encouraged to apply. In compliance with applicable laws and in furtherance of its commitment to fostering an environment that welcomes and embraces diversity Our Client Company does not discriminate on the basis of race, color, creed, religion, national origin, sex (including pregnancy and parenting status), disability, age, sexual orientation, gender identity or expression, marital status or genetic information in its programs or activities, including employment. Qualified candidates are required to send their updated CV Share Job Post",,Confidential," on key analytic / reporting needs from key business stakeholders •Query data from various internal and external databases using database languages (e.g., SQL, U-SQL) •Clean, interpret, and analyze data using statistical techniques •Build models, analysis, and transformations on internal data using Excel, SQL and R •Test and QA code to ensure high-quality analysis •Design user-friendly, clear, and impactful presentations of analytic findings •Improve and streamline technical and business processes •Train stakeholders throughout the business to improve data fluency •Work together with the business to ensure we are enabling data-driven decision making on the most important business questions EXPERIENCE AND SKILLS •2+ years’ experience working in technical data analytics, with excellent skills in SQL and preferred skills in advanced analytical, statistical, and / or programming skills, including R, Python, DAX, Excel, and data visualization tools (e.g. PowerBI, Tableau) •Career passion and if possible, education background preferred in Statistics, Mathematics, Computer Science, Economics or related field •Strong preference for candidates based in or with strong experience working in the markets or similar markets •Preference for candidates who have worked directly delivering data driven insights and analysis from Artificial Intelligence and Machine learning data science models •Excellent communication skills and ability to work and equal ability to influence executives across cross-functions and geographies •Experience and a high capacity in managing multiple problems and assignments at the same time and delivering high quality outputs •In-depth knowledge of business effectiveness tools COMPENSATION : Competitive package covering a monthly salary, performance bonus and medical benefits reflective of the candidate’s experience and skills. Women, minorities and people with disabilities are strongly encouraged to apply. In compliance with applicable laws and in furtherance of its commitment to fostering an environment that welcomes and embraces diversity Our Client Company does not discriminate on the basis of race, color, creed, religion, national origin, sex (including pregnancy and parenting status), disability, age, sexual orientation, gender identity or expression, marital status or genetic information in its programs or activities, including employment. Qualified candidates are required to send their updated CV Share Job Post",Software & Data,Nairobi,N/A,https://www.brightermonday.co.ke/listings/business-intelligent-analyst-2qw57v,https://www.brightermonday.co.ke,N/A
1,Potential Staffing Limited,N/A,Kenya,N/A, We are looking for an experienced Investment Analyst to undertake financial research and report on prospective investment avenues. The successful candidate will study how an investment is likely to perform and how sustainable it is. You will participate in our sound portfolio-management strategy by providing the necessary data for our decision making process. Minimum Qualification: Bachelor Experience Level: Mid level Experience Length: 2 years Job Description ,,Recruitment,Investment Analyst,,,1,,N/A," • Proven working experience as an Investment Analyst • Solid understanding of financial set-up, procedures, statistics and economics • Excellent investment analysis software user • Strong numeric skills • Excellent quantitative and qualitative analytical skills • BS degree in Finance, Accounting or related field Qualifications: Qualified candidates are encouraged to send their updated CV. Share Job Post",,Confidential," • Proven working experience as an Investment Analyst • Solid understanding of financial set-up, procedures, statistics and economics • Excellent investment analysis software user • Strong numeric skills • Excellent quantitative and qualitative analytical skills • BS degree in Finance, Accounting or related field Qualifications: Qualified candidates are encouraged to send their updated CV. Share Job Post","Accounting, Auditing & Finance",Nairobi,N/A,https://www.brightermonday.co.ke/listings/investment-analyst-vekkpm,https://www.brightermonday.co.ke,N/A
