ID,company,contact,country,deadline,description,employmentType,industry,jobTitle,jobType,positionLevel,positions,qualification,readvertised,requirements,responsibilities,salary,skills,technology,town,uploadDate,url,website,year
1,Musakasa Technical Training Institute,N/A,Kenya,N/A, This position is responsible for developing and implementing the institution procurement plan to ensure availability of required goods and services at all times according to the institution requirement and strategies. Minimum Qualification: Bachelor Experience Level: Mid level Experience Length: 7 years Job Description 1.Personal Information Job Title: Supply Chain Management/Procurement officer Job Level: No. of Posts:1 Sector: Technical Training Institutes and institutes of science and Technology Department/section/Unit: Supply Chain Management Reports to: Principal Direct Reports: a) Deputy Supply Chain/procurement officer In direct reports: a) Supply Chain /procurement clerk b) Store keeper 3. Main ,,Education,Supply Chain Management/Procurement Officer,,,1,"s Knowledge and skills: Minimum level of academic qualifications required to perform effectively in the role A bachelor degree in procurement and supplies management, Bachelor of commerce, Business Administration or equivalent from a recognized Institution. Minimum level of professional qualification required to perform effectively in the role: Must be a member of KISM Minimum level of knowledge that would be regularly applied to the Job a) Computer Literacy b) Budgeting c) Knowledge of public Procurement and Asset Disposal Act and Regulations d) Knowledge of professional standards. Typical soft skills that would be regularly applied to the job.(Attributes) a) Leadership skills b) Communication skills c) Interpersonal skills d) Organizational skills e) Ability to work under pressure f) Negotiation skills g) Team building h) Problem solving i) Conflict management j) Supervisory Other requirement e.g. regulatory /statutory/Institutional required implying with for appointment to this role. a) Certificate of good conduct b) Compliance with Chapter 6 of the constitution 6.Relevant ",N/A, can be found on our website at www.musakasatti.ac.ke. All applications should reach the Principal/BOG secretary on or before 13th July 2020 latest 5pm NOTE: The September 2020 intake is in progress and those willing to register may apply using the Institute's website at www.musakasatti.ac.ke. OR email address. musakasa.inst@gmail.com. PRINCIPAL/BOG SECRETARY P.O. Box 1249-50200 BUNGOMA. Share Job Post," a) Develop and implement the institution procurement strategy to ensure timely procurement of goods and services. b) Present Procurement reports to the management to ensure proper recommendations on the gaps identified. c) Coordinate and monitor the implementation of the board procurement recommendations to ensure the implementation meets the set timelines and is compliant with Public Procurement Act and regulations. d) Coordinate the preparation of the procurement work plan to ensure the timely delivery of goods and services. e) Coordinate timely preparation of the institution procurement budget to ensure sufficient resources are allocated for the implementation of the procurement plan. f) Ensure proper maintenance of records and documents for easy retrieval of information when required. Operational responsibilities: a) Monitor compliance with the relevant procurement laws and regulations in order to reduce exposure to risks associated with noncompliance. b) Review and approve invoices for payment to supplier s to ensure transparency in the payment of suppliers. c) Perform due diligence on the suppliers shortlisted , in addition to system checks, to ensure that the institution’s contracts only with suppliers that are compliant as per the procurement Act and the institution’s policies , and that have the capacity to deliver. d) Coordinate the training and development of the procurement staff to ensure they are competent for the delivery services. e) Participate in the tender process to carry out tender evaluation in line with the institution’s procurement policies and procedures in order to select the most qualified suppliers to contract. 4. Job dimensions: Financial Responsibilities: a) Participate in budget preparation b) Participate in the negotiation of the tender contracts. Responsibility for physical Assets: a) Computer and printer b) Office furniture c) Telephone expenditure Nature of decision making: a) Financial b) Strategic c) Operational d) Analytical 5. QualificationExperience Required Minimum number of months or years of experience the job holder is required to have to be appointed to the position. Seven (7) years ’in supply chain management 7. problem solving Problems are complex open ended and affect more than one area of the institution. Solutions need to be determined through consultation with other areas of the institution. 8. Communication Communication/information the job holder needs to understand in order to perform the job: a) Detailed verbal instructions or requests b) Detailed written procedures c) Detailed technical and/or functional instructions or queries d) Detailed e-mail , fax or mail correspondence e) Written government policy documents affecting the job holder’s area of responsibility f) Current legislation affecting the job holder’s area of responsibility g) Factual reports on aspects of the institution such as policy guidelines h) Complex financial reports. Communication/information the job holder needs to carry out in order to perform the job: a) Communication around escalated or difficult queries with internal or external customers or clients b) Detailed technical explanation of services or concepts to employees of the institution or clients c) Detailed e-mail, fax or mail correspondence d) Drafting of factual reports, presentations, procedure or policy documents or training material 9. Influence. Job holder’s influence over practices , policies or strategy: a) Has a strong influence on the strategic direction of more than one department Job holders’ influence over subordinates and colleagues a) Supervises and allocates work to subordinates Job holders’ influence over people outside the directorate but within the institution and people outside the institution. a) Conveys information inside the unit/department b) Conveys information outside unit/department but within the institution. c) Conveys information outside the institution d) Persuades team members within their unit or department e) Persuades team members outside unit/department but within the institution 10.Other responsibilities assigned outside of the core responsibilities of the job: N/A 11. Working conditions Working Environment Is exposed to minimum disagreeable conditions in the environment. The jobholder has normal office facilities which may include own office with desk, access to a telephone line with the outside world. Job Hazards: Slight. There is very slight chance of accident or health hazards. Usual office situation, with minimal exposure. Musakasa technical training institute is an equal opportunity employer, female and persons with disability are encouraged to apply. Details of duties and ",Confidential, can be found on our website at www.musakasatti.ac.ke. All applications should reach the Principal/BOG secretary on or before 13th July 2020 latest 5pm NOTE: The September 2020 intake is in progress and those willing to register may apply using the Institute's website at www.musakasatti.ac.ke. OR email address. musakasa.inst@gmail.com. PRINCIPAL/BOG SECRETARY P.O. Box 1249-50200 BUNGOMA. Share Job Post,Supply Chain & Procurement,Rest of Kenya,N/A,https://www.brightermonday.co.ke/listings/supply-chain-managementprocurement-officer-p6j2mw,https://www.brightermonday.co.ke,N/A
1,Mawego Technical Training Institute,N/A,Kenya,N/A, Applications are invited from qualified Kenyans to be recruited in the above post as per the qualifications and specifications indicated below Minimum Qualification: Bachelor Experience Level: Mid level Experience Length: 3 years Job Description ADVERTISEMENT FOR RECRUITMENT OF STAFF ON BOG TERMS 1. INTERNAL AUDITOR (JOB GROUP K) ,,Education,Internal Auditor,,,1,s i. Bachelor degree in Finance of related field from recognized institution ii. CPA K and ICPAK membership iii. Certificate of Computerized Information Systems Audit(CISA) iv. Computer literacy v. Knowledge on relevant legislation and professional standards vi. Certificate of good conduct vii. Certificate of clearance from HELB viii. CRB clearance certificate ix. Three (3) years minimum ,N/A,". iv. Report to the Audit committee in relation to the adherence to internal systems policies and procedures to avert risks that arise. v. Conduct internal checks in institutional departments to mitigate any arising risks that might expose the institution and prevent fraud. vi. Any other duty that may be assigned by the management Qualificationexperience Application to be addressed to: THE PRINCIPAL, MAWEGO TECHNICAL TRAINING INSTITUTE, P.O BOX 289 – 40222, OYUGIS. To reach on or before 14th July 2020 Share Job Post",,Confidential,". iv. Report to the Audit committee in relation to the adherence to internal systems policies and procedures to avert risks that arise. v. Conduct internal checks in institutional departments to mitigate any arising risks that might expose the institution and prevent fraud. vi. Any other duty that may be assigned by the management Qualificationexperience Application to be addressed to: THE PRINCIPAL, MAWEGO TECHNICAL TRAINING INSTITUTE, P.O BOX 289 – 40222, OYUGIS. To reach on or before 14th July 2020 Share Job Post","Accounting, Auditing & Finance",Rest of Kenya,N/A,https://www.brightermonday.co.ke/listings/internal-auditor-vekqww,https://www.brightermonday.co.ke,N/A
1,Mawego Technical Training Institute,N/A,Kenya,N/A, Applications are invited from qualified Kenyans to be recruited in the above post as per the qualifications and specifications indicated below Minimum Qualification: Diploma Experience Level: Mid level Experience Length: 3 years Job Description ADVERTISEMENT FOR RECRUITMENT OF STAFF ON BOG TERMS 4. CLINICAL OFFICER JOB GROUP J ,,Education,Clinical Officer,,,1,s i. Diploma in Clinical Medicine or its equivalent from a recognized institution ii. Registration with Kenya Clinical officers Council (COC) iii. Computer Literacy. iv. Certificate of good conduct v. Clearance certificate from HELB vi. Certificate of clearance from CRB. vii. Minimum of three(3) years’ ,N/A,,,Confidential,,Medical & Pharmaceutical,Rest of Kenya,N/A,https://www.brightermonday.co.ke/listings/clinical-officer-nxjzp0,https://www.brightermonday.co.ke,N/A
1,Musakasa Technical Training Institute,N/A,Kenya,N/A," This position is responsible to oversee the human resource and Administration function, supervise all the support service areas as well as maintain staff welfare in the institution. Minimum Qualification: Diploma Experience Level: Mid level Experience Length: 3 years Job Description 1.Personal Information Job Title: Human Resource officer Job Level: No. of Posts:1 Sector: Technical Training Institutes and institutes of science and Technology Department/section/Unit: Human Resource Management Reports to: Deputy Principal Administration Direct Reports: a) Assistant Human Resource Officer In direct reports: a) Clerical officers b) Support staff 3. Main ",,Education,Human Resource Officer,,,1,s Knowledge and skills: Minimum level of academic qualifications required to perform effectively in the role Bachelor’s degree in Business Administration (Management HR Option)/Social sciences with a diploma in Human Resource /Higher Diploma in HRM with 3 years of relevant working ,N/A,". g) Provide counseling and guidance services to the staff to promote staff welfare and wellness. h) Monitor the working environment of the staff to ensure healthy and safety measures are observed. i) Analyze the requirement of the institution to identify gaps and ensure consistent provision of requisite manpower in the institution. j) Process staff promotions, appointments and transfers as per the approval by the management. k) Monitor the implementation of the training programmes to ensure timelines, cost efficiency and high quality standards. l) Communicate to staff on HR matters relating to separation such as benefits, notice periods to ensure smooth separation of employees in the institution. m) Maintain the Human Resource Information system and ensure confidentiality of staff’s personal information. 4. Job dimensions: Financial Responsibilities: a) Provide input in the budgeting process b) Determines the wage bill for the casual workers Responsibility for physical Assets: a) Computer b) Furniture c) Safety equipment e.g. First Aid Kits, Fire Extinguishers Nature of decision making: a) Financial decision b) Operational decision c) Analytical decision 5. Qualificationexperience. Minimum level of professional qualification required to perform effectively in the role: Registered member of IHRM Minimum level of knowledge that would be regularly applied to the Job a) Computer Literacy b) Knowledge of Employment Act and Labour laws. Typical soft skills that would be regularly applied to the job.(Attributes) a) Leadership skills b) Communication skills c) Interpersonal skills d) Organizational skills e) Report writing skills f) Team building g) Problem solving h) Conflict management i) Supervisory j) Counseling skills. 6.Relevant Experience Required Minimum number of months or years of experience the job holder is required to have to be appointed to the position. Five (5) years of relevant working experience 7. problem solving Problems are complex open ended and affect more than one area of the institution. Solutions need to be determined through consultation with other areas of the institution. 8. Communication a) Communication/information the job holder needs to understand in order to perform the job: a) Basic Detailed verbal instructions or requests b) Detailed verbal instructions or requests c) Simple written instructions or request d) Detailed written procedures e) Detailed technical and/or functional instructions or queries f) Basic e-mail , fax or mail correspondence g) Detailed e-mail , fax or mail correspondence h) Written government policy documents i) Current legislation affecting the job holder’s area of responsibility j) Factual reports on aspects of the institution such as policy guidelines Communication/information the job holder needs to carry out in order to perform the job: a) Routine communication in connection with instructions, requests or normal work tasks. b) Routine communication with employees of the institution or clients. c) Communication around escalated or difficult queries with internal or external customers or clients d) Basic explanation of services to employees of the institution or clients. e) Simple verbal instructions to other employees of the institution or clients. f) Detailed verbal or written instructions or requests to employees of the institution or contractors. g) Basic e-mail , fax or mail correspondence h) Detailed e-mail , fax or mail correspondence i) Drafting of factual reports, presentation, procedure or policy documents or training material. 9. Influence. Job holder’s influence over practices , policies or strategy: a) The Human Resource Officer allocate and supervise work to assistant human resource officer, secretaries, clerical officers and receptionist in the institution Job holders’ influence over subordinates and colleagues a) Influence or changes specific administrative or operational practices affecting more than one department. Job holders’ influence over people outside the directorate but within the institution and people outside the institution. a) Conveys information inside the unit/department b) Conveys information outside unit/department but within the institution. c) Conveys information outside the institution d) Persuades team members within their unit or department 10.Other responsibilities assigned outside of the core responsibilities of the job: N/A 11. Working conditions Working Environment Is exposed to minimum disagreeable conditions in the environment. The jobholder has normal office facilities which may include own office with desk, access to a telephone line with the outside world. Job Hazards: Slight. There is very slight chance of accident or health hazards. Usual office situation, with minimal exposure. Musakasa technical training institute is an equal opportunity employer, female and persons with disability are encouraged to apply. Details of duties and requirements can be found on our website at www.musakasatti.ac.ke. All applications should reach the Principal/BOG secretary on or before 13th July 2020 latest 5pm NOTE: The September 2020 intake is in progress and those willing to register may apply using the Institute's website at www.musakasatti.ac.ke. OR email address. musakasa.inst@gmail.com. PRINCIPAL/BOG SECRETARY P.O. Box 1249-50200 BUNGOMA. Share Job Post"," a) Develop the human resource planning policy and procedures in line with the institution overall policy. b) Advise the council /BOG on matters relating to Human resource policies so as to make informed decisions. c) Act as the link between the management and the union through negotiations formulation of agreement such as collective bargaining agreements tonsure smooth Labour relations in the institution. d) Oversee the human resource trainings and develop through liaison with other departments to establish human resource needs. e) Supervise variety of administrative service areas including catering, boarding, secretaries, and transport to ensure all the operations in the institution are carried out smoothly. f) Oversee the administration of the staff appraisal forms and review the staff annual appraisals reports to monitor staff performance in the institution. g) Oversee recruitment and appointment of staff to ensure the institution has the right staffing. Operational responsibilities: a) Advice staff on all aspects of the Human Resource function which include recruitment, training, and development, and performance management to ensure awareness of staff on the expectations of the institution and the benefits and opportunities available to the staff. b) Validate information collected on letters of promotion, probation, appointment to ensure accuracy of data. c) Process all approved staff leaves in line with the leave schedule to ensure no overlaps. d) Manage and update the payroll to ensure compliance with the payroll process and government regulations. e) Handle the staff discipline and grievances issues to ensure that the best practice in the management of discipline are instilled in the institution. f) Review employment and working conditions to ensure legal compliance ",Confidential,". g) Provide counseling and guidance services to the staff to promote staff welfare and wellness. h) Monitor the working environment of the staff to ensure healthy and safety measures are observed. i) Analyze the requirement of the institution to identify gaps and ensure consistent provision of requisite manpower in the institution. j) Process staff promotions, appointments and transfers as per the approval by the management. k) Monitor the implementation of the training programmes to ensure timelines, cost efficiency and high quality standards. l) Communicate to staff on HR matters relating to separation such as benefits, notice periods to ensure smooth separation of employees in the institution. m) Maintain the Human Resource Information system and ensure confidentiality of staff’s personal information. 4. Job dimensions: Financial Responsibilities: a) Provide input in the budgeting process b) Determines the wage bill for the casual workers Responsibility for physical Assets: a) Computer b) Furniture c) Safety equipment e.g. First Aid Kits, Fire Extinguishers Nature of decision making: a) Financial decision b) Operational decision c) Analytical decision 5. Qualificationexperience. Minimum level of professional qualification required to perform effectively in the role: Registered member of IHRM Minimum level of knowledge that would be regularly applied to the Job a) Computer Literacy b) Knowledge of Employment Act and Labour laws. Typical soft skills that would be regularly applied to the job.(Attributes) a) Leadership skills b) Communication skills c) Interpersonal skills d) Organizational skills e) Report writing skills f) Team building g) Problem solving h) Conflict management i) Supervisory j) Counseling skills. 6.Relevant Experience Required Minimum number of months or years of experience the job holder is required to have to be appointed to the position. Five (5) years of relevant working experience 7. problem solving Problems are complex open ended and affect more than one area of the institution. Solutions need to be determined through consultation with other areas of the institution. 8. Communication a) Communication/information the job holder needs to understand in order to perform the job: a) Basic Detailed verbal instructions or requests b) Detailed verbal instructions or requests c) Simple written instructions or request d) Detailed written procedures e) Detailed technical and/or functional instructions or queries f) Basic e-mail , fax or mail correspondence g) Detailed e-mail , fax or mail correspondence h) Written government policy documents i) Current legislation affecting the job holder’s area of responsibility j) Factual reports on aspects of the institution such as policy guidelines Communication/information the job holder needs to carry out in order to perform the job: a) Routine communication in connection with instructions, requests or normal work tasks. b) Routine communication with employees of the institution or clients. c) Communication around escalated or difficult queries with internal or external customers or clients d) Basic explanation of services to employees of the institution or clients. e) Simple verbal instructions to other employees of the institution or clients. f) Detailed verbal or written instructions or requests to employees of the institution or contractors. g) Basic e-mail , fax or mail correspondence h) Detailed e-mail , fax or mail correspondence i) Drafting of factual reports, presentation, procedure or policy documents or training material. 9. Influence. Job holder’s influence over practices , policies or strategy: a) The Human Resource Officer allocate and supervise work to assistant human resource officer, secretaries, clerical officers and receptionist in the institution Job holders’ influence over subordinates and colleagues a) Influence or changes specific administrative or operational practices affecting more than one department. Job holders’ influence over people outside the directorate but within the institution and people outside the institution. a) Conveys information inside the unit/department b) Conveys information outside unit/department but within the institution. c) Conveys information outside the institution d) Persuades team members within their unit or department 10.Other responsibilities assigned outside of the core responsibilities of the job: N/A 11. Working conditions Working Environment Is exposed to minimum disagreeable conditions in the environment. The jobholder has normal office facilities which may include own office with desk, access to a telephone line with the outside world. Job Hazards: Slight. There is very slight chance of accident or health hazards. Usual office situation, with minimal exposure. Musakasa technical training institute is an equal opportunity employer, female and persons with disability are encouraged to apply. Details of duties and requirements can be found on our website at www.musakasatti.ac.ke. All applications should reach the Principal/BOG secretary on or before 13th July 2020 latest 5pm NOTE: The September 2020 intake is in progress and those willing to register may apply using the Institute's website at www.musakasatti.ac.ke. OR email address. musakasa.inst@gmail.com. PRINCIPAL/BOG SECRETARY P.O. Box 1249-50200 BUNGOMA. Share Job Post",Human Resources,Rest of Kenya,N/A,https://www.brightermonday.co.ke/listings/human-resource-officer-kgx28m,https://www.brightermonday.co.ke,N/A
